{
  "schema": 1,
  "id": "correlation_and_regression",
  "title": "相关、拟合与预测的边界",
  "stage": "senior",
  "topic_ids": [
    "mh5.8.1.1",
    "mh5.8.1.2",
    "mh5.8.2.1",
    "mh5.8.2.2"
  ],
  "standard_ids": [
    "cms-2017:H.PS.05"
  ],
  "review_status": "draft",
  "author_type": "ai",
  "objectives": [
    {
      "id": "correlation_and_regression:correlation",
      "statement": "能根据样本相关系数和散点形状解释线性趋势，区分零线性相关与未定义的相关系数。",
      "granularity": "observable",
      "prerequisite_objective_ids": [
        "sampling_and_variation:centre",
        "sampling_and_variation:spread"
      ]
    },
    {
      "id": "correlation_and_regression:ols",
      "statement": "能在含截距的一元最小二乘条件下由成对数据或样本中心求拟合系数，并检查横坐标变异条件。",
      "granularity": "observable",
      "prerequisite_objective_ids": [
        "data_reading_and_mean:mean",
        "linear_function_representations:formula"
      ]
    },
    {
      "id": "correlation_and_regression:residual",
      "statement": "能按观测值减预测值计算有符号残差，并用图中上下位置解释正负。",
      "granularity": "observable",
      "prerequisite_objective_ids": [
        "linear_function_representations:formula"
      ]
    },
    {
      "id": "correlation_and_regression:r_squared",
      "statement": "能在明确的含截距一元最小二乘条件下解释R²=r²，区分样本解释变异、残差比例与因果或预测准确率。",
      "granularity": "observable",
      "prerequisite_objective_ids": [
        "correlation_and_regression:correlation",
        "correlation_and_regression:residual"
      ]
    },
    {
      "id": "correlation_and_regression:prediction_limits",
      "statement": "能对基于观察数据的预测说明样本范围与关联证据的限制，指出外推或因果推断所需的额外依据。",
      "granularity": "observable",
      "prerequisite_objective_ids": [
        "correlation_and_regression:correlation",
        "correlation_and_regression:residual",
        "sampling_and_variation:inference"
      ]
    }
  ],
  "prerequisites": [
    "能计算平均数、平方离差，读懂坐标与一次函数。",
    "能用代数式进行加减乘除；本单元给出所需拟合公式。"
  ],
  "explanation": {
    "intuition": "点接近一条线说明样本中有线性趋势；把线延长到很远处并不会增加证据。预测值是线上的位置，实际数据到线的竖直差仍应保留。",
    "reasoning": "对x、y都具有非零样本变异的数据，r=Σ(xᵢ−x̄)(yᵢ−ȳ)/√[Σ(xᵢ−x̄)²Σ(yᵢ−ȳ)²]。含截距的一元最小二乘拟合选择ŷ=a+bx使残差平方和最小；Sxx>0时b=Sxy/Sxx，a=ȳ−bx̄，因此线过样本中心，残差eᵢ=yᵢ−ŷᵢ。若SST=Σ(yᵢ−ȳ)²>0，定义R²=1−SSE/SST；在同一组数据的含截距一元最小二乘拟合下R²=r²。这个量描述样本内拟合，不证明原因或未来准确率。",
    "conditions": [
      "相关系数要求x与y的离差平方和都大于0；某一变量全相同时r未定义，而不是0。",
      "最小二乘的斜率公式要求Sxx>0；本单元所说过样本中心和R²=r²都限定含截距的一元最小二乘拟合。",
      "残差按观测减预测；SSE为残差平方和，SST为相对样本均值的离差平方和，二者必须来自同一组数据。",
      "r=0不能排除非线性关系；异常点、取值范围与样本选择都可能影响r。",
      "对新值预测要检查原有范围与模型适用条件。观察性相关不能单独证明干预会造成变化。"
    ],
    "counterexample": "五点(−2,4)、(−1,1)、(0,0)、(1,1)、(2,4)满足y=x²，中心化交叉乘积正负相消，r=0，但有明确曲线关系。另对(1,3)、(2,4)，r=1；若强制过原点拟合ŷ=2.2x，按1−SSE/SST得到−0.6而不是1，说明不能省略截距条件。"
  },
  "worked_examples": [
    {
      "prompt": "r₁=−0.9、r₂=0.4，两组都满足r的定义条件。怎样比较？若所有x都相同呢？",
      "steps": [
        "第一组为负线性相关，第二组为正线性相关。",
        "比较绝对值0.9与0.4，第一组样本线性关系更强。",
        "所有x相同时Sxx=0，r的分母为0，不能算r=0或±1。"
      ],
      "answer": "第一组负且更强；常数x时r未定义。",
      "family_id": "statistics.correlation-sign-and-domain",
      "variant_id": "correlation_and_regression:example-1",
      "representation": "symbolic",
      "cognitive_demand": "explain"
    },
    {
      "prompt": "对三条成对数据(0,2)、(1,7)、(2,6)作含截距一元最小二乘拟合，并求x=1那条观测的残差。",
      "steps": [
        "x̄=1，ȳ=5；Sxx=1+0+1=2，Sxy=(−1)(−3)+0×2+1×1=4。",
        "b=4/2=2，a=5−2×1=3。",
        "x=1时预测5、观测7，残差7−5=2，点在线上方。"
      ],
      "answer": "ŷ=3+2x；中间点残差2。",
      "family_id": "statistics.ols-from-paired-data",
      "variant_id": "correlation_and_regression:example-2",
      "reference_family_ids": [
        "statistics.ols-intercept-from-centre",
        "statistics.signed-residual",
        "statistics.prediction-substitution"
      ],
      "representation": "symbolic",
      "cognitive_demand": "execute"
    },
    {
      "prompt": "同一组非退化样本作含截距一元最小二乘回归，r=−0.8。R²是多少，能说80%的人一定被预测准确吗？",
      "steps": [
        "R²=r²=(−0.8)²=0.64。",
        "0.64是样本总离差平方和的拟合解释比例，剩余0.36为相应残差平方和比例。",
        "它不是按人数计的命中率，不说明某个人是否预测准确，也不证明因果。"
      ],
      "answer": "R²=0.64；不能解读为人数命中率或因果比例。",
      "family_id": "statistics.r-squared-interpretation",
      "variant_id": "correlation_and_regression:example-3",
      "representation": "symbolic",
      "cognitive_demand": "explain"
    },
    {
      "prompt": "只在x为0到10时收集数据并拟合ŷ=2x+1。能仅因式子有定义，就保证x=100时实际y=201吗？",
      "steps": [
        "代入可得模型形式上的数值201。",
        "100远超已有范围，线性关系可能不继续成立。",
        "即使范围内预测也可能有残差；应区分代入算值与模型适用证据。"
      ],
      "answer": "201是外推值，原数据不保证实际值为201。",
      "family_id": "statistics.extrapolation-boundary",
      "variant_id": "correlation_and_regression:example-4",
      "representation": "verbal",
      "cognitive_demand": "explain"
    }
  ],
  "tasks": [
    {
      "id": "correlation_and_regression:practice-1",
      "objective_ids": [
        "correlation_and_regression:correlation"
      ],
      "phase": "practice",
      "type": "choice",
      "prompt": "两组非退化样本的相关系数分别为−0.8和0.4。正确解释是哪项？",
      "explanation": "方向由符号区分，线性强弱按绝对值比较；0.8>0.4。观察到负相关不能直接推出因果。",
      "feedback": {
        "correct": "请对照解释核对依据、单位和适用条件。",
        "incorrect": "分别比较方向与绝对值，不把负号当成较弱。"
      },
      "family_id": "statistics.correlation-sign-and-domain",
      "variant_id": "correlation_and_regression:practice-1",
      "representation": "symbolic",
      "cognitive_demand": "explain",
      "answer_spec": {
        "kind": "choice"
      },
      "answer": "B",
      "choices": [
        {
          "id": "A",
          "text": "−0.8较小，所以第一组线性相关更弱"
        },
        {
          "id": "B",
          "text": "第一组负线性相关且按绝对值比较更强"
        },
        {
          "id": "C",
          "text": "第一组证明x增加必然导致y降低"
        }
      ]
    },
    {
      "id": "correlation_and_regression:practice-2",
      "objective_ids": [
        "correlation_and_regression:ols"
      ],
      "phase": "practice",
      "type": "numeric",
      "prompt": "含截距的一元最小二乘拟合斜率b=2，样本中心(x̄,ȳ)=(2,5)，且x有非零变异。截距a是多少？",
      "explanation": "含截距最小二乘线过样本中心，a=ȳ−bx̄=5−2×2=1。",
      "feedback": {
        "correct": "请对照解释核对依据、单位和适用条件。",
        "incorrect": "使用a=ȳ−bx̄，注意题目给出的拟合方法。"
      },
      "family_id": "statistics.ols-intercept-from-centre",
      "variant_id": "correlation_and_regression:practice-2",
      "representation": "symbolic",
      "cognitive_demand": "execute",
      "answer_spec": {
        "kind": "number",
        "comparison": "exact",
        "representation": "any"
      },
      "answer": "1",
      "verify": "5-2*2"
    },
    {
      "id": "correlation_and_regression:practice-3",
      "objective_ids": [
        "correlation_and_regression:residual"
      ],
      "phase": "practice",
      "type": "numeric",
      "prompt": "预测式ŷ=2x+1。某条观测为x=3、y=9，按e=y−ŷ计算残差。",
      "explanation": "预测值为7，观测9高于预测2，残差9−7=2。",
      "feedback": {
        "correct": "请对照解释核对依据、单位和适用条件。",
        "incorrect": "先算同一x处的预测，再用观测减预测。"
      },
      "family_id": "statistics.signed-residual",
      "variant_id": "correlation_and_regression:practice-3",
      "representation": "symbolic",
      "cognitive_demand": "execute",
      "answer_spec": {
        "kind": "number",
        "comparison": "exact",
        "representation": "any"
      },
      "answer": "2",
      "verify": "9-(2*3+1)"
    },
    {
      "id": "correlation_and_regression:practice-4",
      "objective_ids": [
        "correlation_and_regression:r_squared"
      ],
      "phase": "practice",
      "type": "numeric",
      "prompt": "对同一组x、y都有非零变异的样本作含截距一元最小二乘回归，r=0.6。样本决定系数R²是多少？请填小数。",
      "explanation": "题设满足R²=r²的条件，所以R²=0.36。这不是36%的个体一定预测正确。",
      "feedback": {
        "correct": "请对照解释核对依据、单位和适用条件。",
        "incorrect": "在给定条件下平方r，不保留其正负方向。"
      },
      "family_id": "statistics.r-squared-interpretation",
      "variant_id": "correlation_and_regression:practice-4",
      "representation": "symbolic",
      "cognitive_demand": "execute",
      "answer_spec": {
        "kind": "number",
        "comparison": "exact",
        "representation": "any"
      },
      "answer": "0.36",
      "verify": "0.6**2"
    },
    {
      "id": "correlation_and_regression:practice-5",
      "objective_ids": [
        "correlation_and_regression:prediction_limits"
      ],
      "phase": "practice",
      "type": "rubric",
      "prompt": "某城市多个月份中，冰饮销量与游泳人数正相关。有人据此说“多卖冰饮就会使更多人游泳”。仅凭这些观察数据能得出该因果结论吗？提出一种其他可能解释。",
      "explanation": "较热月份可能同时增加冰饮需求和游泳人数，观察到的相关与这个共同原因相容。仅凭相关不能确认改变销量会引起人数变化。",
      "feedback": {
        "correct": "请按量规逐项自查并保留过程；自评不等于独立评价。",
        "incorrect": "找一个可能同时影响两个变量的因素。"
      },
      "family_id": "statistics.observational-causality",
      "variant_id": "correlation_and_regression:practice-5",
      "representation": "verbal",
      "cognitive_demand": "explain",
      "answer_spec": {
        "kind": "rubric"
      },
      "rubric": [
        {
          "criterion": "区分相关与因果",
          "points": 2,
          "example": "共同变化不能单独证明卖冰饮造成游泳人数改变。"
        },
        {
          "criterion": "给出可行的共同因素或局限",
          "points": 2,
          "example": "如气温或季节同时影响两者，月份样本和测量口径也需考虑。"
        }
      ]
    },
    {
      "id": "correlation_and_regression:transfer-1",
      "objective_ids": [
        "correlation_and_regression:correlation"
      ],
      "phase": "transfer",
      "type": "rubric",
      "prompt": "下图B五点为(−2,4)、(−1,1)、(0,0)、(1,1)、(2,4)。说明r为什么为0，并判断“r=0，所以两个变量没有任何关系”是否成立。",
      "explanation": "Sxy=(−2)(4−2)+(−1)(1−2)+0(0−2)+1(1−2)+2(4−2)=0；Sxx与Syy均非零，故r=0。图中仍有确定的y=x²关系。",
      "feedback": {
        "correct": "请按量规逐项自查并保留过程；自评不等于独立评价。",
        "incorrect": "先用正负x的成对对称核对交叉乘积，再观察曲线形状。"
      },
      "family_id": "statistics.zero-correlation-nonlinearity",
      "variant_id": "correlation_and_regression:transfer-1",
      "representation": "graph",
      "cognitive_demand": "explain",
      "answer_spec": {
        "kind": "rubric"
      },
      "rubric": [
        {
          "criterion": "核对r的分子与定义条件",
          "points": 2,
          "example": "x̄=0，ȳ=2；交叉离差和−4+1+0−1+4=0，两变量变异均非零。"
        },
        {